{"schema":"ces.finding_projection.v1","status":"partial","exit_code":2,"reason_code":"FINDING_IN_MEMORY_ASSERTIONS_NOT_OBJECTIVELY_TESTED","source_binding":{"run_id":"run_v1_111111111111111111111111111111111111111111111111","handoff_id":"handoff_v1_222222222222222222222222222222222222222222222222","stage_revision":1,"stage_event_sha256":"0000000000000000000000000000000000000000000000000000000000000000","source_mode":"WorkingTree","task_kind":"code_analysis","source_context_sha256":"0000000000000000000000000000000000000000000000000000000000000000","source_identity_sha256":"0000000000000000000000000000000000000000000000000000000000000000","evidence_hash":"0000000000000000000000000000000000000000000000000000000000000000","material_sha256":"0000000000000000000000000000000000000000000000000000000000000000"},"coverage":{"complete_for_selected_source":false,"missing_requirements_count":1,"historical_proposal_only":false,"source_currentness_proven":false},"findings":[],"findings_count":0,"saved_metadata_link":null,"effects":{"findings_persisted":false,"ces_records_written":false,"business_repository_written":false,"git_or_issue_written":false,"source_code_or_tests_executed":false,"external_transfer":false},"trust_boundary":"SEALED_LOCAL_SOURCE_AND_OPTIONAL_PRIVATE_HMAC_ONLY_NO_SEMANTIC_TEST_GIT_OR_ACTOR_PROOF","projection_sha256":"0000000000000000000000000000000000000000000000000000000000000000"}
